siren,nom_orig,nom_pappers,objet_social,code_naf,libelle_naf,forme_juridique,date_creation,entreprise_cessee,date_cessation,adresse_ligne_1,complement_adresse,code_postal,ville,latitude,longitude,enseigne,nom_commercial,siret_siege,nb_etablissements_actifs,nb_etablissements_total,procedure_collective_en_cours,derniere_procedure_type,classification_finale,source_classification
818863821,JINFA,JINFA,"Pressing blanchisserie, retoucherie",96.01B,Blanchisserie-teinturerie de détail,"SARL, société à responsabilité limitée",2016-02-29,False,,16 B RUE JOUFFROY D'ABBANS,,75017,PARIS,48.886593999801846,2.311193000002853,JINFA,JINFA,81886382100018,1,1,False,Liquidation judiciaire,PRESSING,A4_reclass
478663180,AU FIL DE L'EAU,AU FIL DE L'EAU,PRESSING LAVERIE,96.01B,Blanchisserie-teinturerie de détail,"SARL, société à responsabilité limitée",2004-08-24,False,,75 RUE DE BELLEVUE,,92100,BOULOGNE-BILLANCOURT,48.83520199980187,2.2308660000031835,,,47866318000014,0,2,False,Liquidation judiciaire,MIXTE,A4_reclass
535406375,SAVOIR FER,SAVOIR FER,Pressing,96.01B,Blanchisserie-teinturerie de détail,"SARL, société à responsabilité limitée",2011-10-19,False,,48 RUE GABRIEL PERI,LOT DU MARCHE,92320,CHATILLON,48.801381999801826,2.2868300000029507,,,53540637500019,1,1,False,,PRESSING,A4_reclass
510257207,OUSMER SARL,OUSMER SARL,Laverie libre service automatique.,96.01B,Blanchisserie-teinturerie de détail,"SARL, société à responsabilité limitée",2009-02-01,False,,19 RUE CLAVEL,,75019,PARIS,48.87523499980184,2.3840590000025523,SARL OUSMER,OUSMER SARL,51025720700017,1,1,False,,LS_PURE_NEW,A4_reclass
753106160,MANU,MANU,PRESSING RETOUCHE ET COUTURE EN TOUT GENRE,96.01B,Blanchisserie-teinturerie de détail,"SARL, société à responsabilité limitée",2012-08-01,False,,44 COURS DE VINCENNES,,75012,PARIS,48.84737999980185,2.402889000002472,,,75310616000017,1,1,False,,PRESSING,A4_reclass
814397899,RAIMELA,RAIMELA,"Pressing, cordonnerie, clés minutes, retouches. Vente de prêt à porter.",96.01B,Blanchisserie-teinturerie de détail,"SARL, société à responsabilité limitée",2015-10-29,False,,4 PASSAGE DU POTEAU,,75018,PARIS,48.8973699998018,2.3373900000027463,,,81439789900018,0,1,False,,PRESSING,A4_reclass
809904071,LIN YUN,LIN YUN,Pressing et retouche de vêtement.,96.01B,Blanchisserie-teinturerie de détail,"SAS, société par actions simplifiée",2015-02-24,False,,36 RUE JEAN MARIDOR,,75015,PARIS,48.83822999980183,2.287387000002949,PRESSING,,80990407100010,1,1,False,,PRESSING,A4_reclass
793940222,CAROCAT,CAROCAT,"Pressing, teinturerie, blanchisserie, nettoyage à sec, clés minutes, remaillage.",96.01B,Blanchisserie-teinturerie de détail,"SAS, société par actions simplifiée",2013-07-01,False,,3 RUE HENRI RIBIERE,,75019,PARIS,48.87635799980183,2.395117000002505,PLACE DES FITES,,79394022200029,1,2,False,,PRESSING,A4_reclass
919151597,ATELIER DE LA CHEMISE,ATELIER DE LA CHEMISE,Repassage - lavage - blanchisserie - dépôt pressing - retouches,96.01B,Blanchisserie-teinturerie de détail,"SASU, société par actions simplifiée unipersonnelle",2022-01-21,False,,221 RUE CHAMPIONNET,,75018,PARIS,48.89342499980183,2.329708000002778,,ATELIER DE LA CHEMISE,91915159700011,1,1,False,,PRESSING,A4_reclass
752899385,LE MAROIS PEPINIERE,LE MAROIS PEPINIERE,"Pressing automatique, laverie.",96.01B,Blanchisserie-teinturerie de détail,"SARL, société à responsabilité limitée",2012-07-12,False,,26 RUE DE LA PEPINIERE,,75008,PARIS,48.87508899980182,2.3210030000028126,LE MAROIS PEPINIERE,,75289938500013,1,1,False,,MIXTE,A4_reclass
421348426,NINIVE,NINIVE,PRESSING BLANCHISSERIE LAVERIE REPASSERIE,96.01B,Blanchisserie-teinturerie de détail,"SARL, société à responsabilité limitée",1999-02-01,False,,153 RUE RAYMOND LOSSERAND,,75014,PARIS,48.830947999801836,2.312549000002846,HARMONY PRESSING DISCOUNT,NINIVE,42134842600014,1,1,True,Liquidation judiciaire,MIXTE,A4_reclass
818922304,LAMRANI SAS,LAMRANI SAS,"Teinturerie, bonneterie, nouveautés et lingerie",96.01B,Blanchisserie-teinturerie de détail,"SASU, société par actions simplifiée unipersonnelle",2016-03-04,False,,33 RUE HENRI BARBUSSE,,75005,PARIS,48.84092499980183,2.3387200000027377,LATIN PRESSING,,81892230400014,1,1,False,,AUTRE,A4_reclass
887760155,JONONI,JONONI,"Pressing, nettoyage repassage, retouche.",96.01B,Blanchisserie-teinturerie de détail,"SASU, société par actions simplifiée unipersonnelle",2020-08-01,False,,3 RUE AUGUSTE BARTHOLDI,,75015,PARIS,48.85079099980185,2.2947100000029206,,,88776015500010,1,1,False,,PRESSING,A4_reclass
752900118,D P C,D P C,"Teinturerie, blanchisserie",96.01B,Blanchisserie-teinturerie de détail,"SAS, société par actions simplifiée",2012-07-17,False,,105 B RUE CARDINET,,75017,PARIS 17,0,0,,,75290011800023,0,2,False,,PRESSING,A4_reclass
801711169,ARC EN CIEL,ARC EN CIEL,BLANCHISSERIE TEINTURERIE PRESSING REPASSERIE,96.01B,Blanchisserie-teinturerie de détail,"SARL, société à responsabilité limitée",2014-04-14,False,,268 RUE DE CHARENTON,,75012,PARIS,48.836719999801836,2.391545000002519,,,80171116900012,2,2,False,,PRESSING,A4_reclass
404574048,NEW'CLEAN,NEW'CLEAN,Pressing nettoyage à sec blanchisserie laverie auto - couture,96.01B,Blanchisserie-teinturerie de détail,"SARL, société à responsabilité limitée",1995-09-21,False,,29 BOULEVARD DE STALINGRAD,CTRE COMM. HENRI BARBUSSE,92240,MALAKOFF,48.814038999801845,2.2865170000029513,,NEW'CLEAN,40457404800017,1,1,False,,MIXTE,A4_reclass
952194058,RD5 SASU R.D.5,RD5 SASU R.D.5,PRESSING - BLANCHISSERIE - TEINTURERIE - LAVERIE,96.01B,Blanchisserie-teinturerie de détail,"SASU, société par actions simplifiée unipersonnelle",2023-05-04,False,,92 T AVENUE DE VERDUN,,94200,IVRY-SUR-SEINE,48.80703799980185,2.3747800000025867,PRESSING R.D.5,,95219405800014,2,3,False,,MIXTE,A4_reclass
492523659,LA MARGUERITE D'ALFORTVILLE,LA MARGUERITE D'ALFORTVILLE,"Laverie libre service, repassage, retouche.",96.01B,Blanchisserie-teinturerie de détail,"SARL, société à responsabilité limitée",2006-10-21,False,,16 RUE CHARLES DE GAULLE,,94140,ALFORTVILLE,48.81445299980185,2.413664000002426,,,49252365900018,2,2,False,,LS_PURE_NEW,A4_reclass
853652535,ZBH EURL,ZBH EURL,Pressing- laverie- Multiservices- vente- retouches,96.01B,Blanchisserie-teinturerie de détail,"SARL, société à responsabilité limitée",2019-09-01,False,,111 BOULEVARD SERURIER,RDC,75019,PARIS,48.880624999801825,2.3975160000024967,ZBH,SAB'S WASH & LAUNDRY,85365253500016,1,1,False,,MIXTE,A4_reclass
752490458,TIMILT,TIMILT,"Laverie,  blanchisserie,  pressing , nettoyage de vêtement , retouche , vente de Boutonnerie, Et accessoire de vêtements , confection.",96.01B,Blanchisserie-teinturerie de détail,"SARL, société à responsabilité limitée",2012-06-15,False,,8 AVENUE CHANDON,,92230,GENNEVILLIERS,48.92408799980183,2.295274000002923,,,75249045800011,1,1,False,,MIXTE,A4_reclass
828374280,SPRING XIA,SPRING XIA,"Laverie libre-service, retouches, repassage, service à la personne",96.01B,Blanchisserie-teinturerie de détail,"SARL, société à responsabilité limitée",2017-03-14,False,,2 RUE GEORGE EASTMAN,,75013,PARIS,48.82937099980183,2.3597850000026495,LAVERIE LIBRE SERVICE,,82837428000018,1,1,False,,LS_PURE_NEW,A4_reclass
433681772,SORANA,SORANA,Blanchisserie-teinturerie de détail,96.01B,Blanchisserie-teinturerie de détail,"SARL, société à responsabilité limitée",2000-11-09,False,,104 RUE SADI CARNOT,,92170,VANVES,48.82485999980184,2.2958130000029136,,,43368177200011,0,1,False,,PRESSING,A4_reclass
790247365,CENNET,CENNET,"Pressing, nettoyage à sec, laverie, blanchisserie, teinturerie, routche, achats, ventes, import export de produits non réglementés.",96.01B,Blanchisserie-teinturerie de détail,"EURL, entreprise unipersonnelle à responsabilité limitée",2013-01-02,False,,7 PROMENADE SAINT-LEUFROY,,92150,SURESNES,48.86860399980185,2.225381000003208,,,79024736500014,1,1,False,,MIXTE,A4_reclass
750452781,EVENTS 26,EVENTS 26,Activités des sièges sociaux,96.01B,Blanchisserie-teinturerie de détail,"SARL, société à responsabilité limitée",2012-03-19,False,,34 RUE SAINT-FARGEAU,,75020,PARIS,48.871599999801816,2.4033990000024708,,,75045278100040,0,4,False,,AUTRE,A4_reclass
512821398,SALMA,SALMA,"Nettoyage à sec, blanchisserie, retoucherie, achat, vente et transformation de tous produits vestimentaires",96.01B,Blanchisserie-teinturerie de détail,"SARL, société à responsabilité limitée",2009-05-13,False,,198 RUE LEGENDRE,,75017,PARIS,48.89238099980183,2.32676800000279,,PRESSING GUY MOQUET,51282139800017,0,1,False,,PRESSING,A4_reclass
448486472,ALPAGA,ALPAGA,"TEINTURERIE, BLANCHISSERIE",96.01B,Blanchisserie-teinturerie de détail,"SARL, société à responsabilité limitée",2003-04-15,False,,28 RUE D'ARMAILLE,,75017,PARIS,48.87865899980184,2.2912950000029357,,,44848647200013,1,1,False,,PRESSING,A4_reclass
482706850,SOPRE LAURE,SOPRE LAURE,TEINTURERIE NETTOYAGE A SEC BLANCHISSERIE,96.01B,Blanchisserie-teinturerie de détail,"SARL, société à responsabilité limitée",2005-05-19,False,,138 RUE MONTMARTRE,,75002,PARIS,48.868607999801846,2.343536000002719,,PRESSING DE LA BOURSE,48270685000013,1,1,False,,PRESSING,A4_reclass
519399653,COLPORTEUR BOUTIQUE,COLPORTEUR BOUTIQUE,"Blanchisserie, teinturerie, pressing, nettoyage, et repassage de tout textile ainsi que la commercialisation de tout article se rapportant à ces activités.",96.01B,Blanchisserie-teinturerie de détail,"SAS, société par actions simplifiée",2010-01-12,False,,4 RUE D'ESTIENNE D'ORVES,,92110,CLICHY,48.90565899980184,2.302303000002892,,,51939965300061,6,7,False,,PRESSING,A4_reclass
343569125,BRIGHT,BRIGHT,"Le commerce de nettoyage vêtements, peaux, fourrures, ameublement, tapis, rideaux, blanchisserie, teinturerie. Achat, vente de tous produits manufactures en textiles y compris pièces détachées, auto. Produits alimentaires. Produits industriels et leurs dérives, Import-Export.",96.01B,Blanchisserie-teinturerie de détail,"EURL, entreprise unipersonnelle à responsabilité limitée",1988-01-22,False,,35 RUE DU COLISEE,,75008,PARIS,48.87155199980183,2.310377000002857,,,34356912500028,1,2,False,,PRESSING,A4_reclass
852299148,CLEMMA,CLEMMA,Pressing.,96.01B,Blanchisserie-teinturerie de détail,"EURL, entreprise unipersonnelle à responsabilité limitée",2019-06-17,False,,295 BOULEVARD RASPAIL,,75014,PARIS,48.83517999980186,2.332423000002763,,,85229914800019,1,1,False,,PRESSING,A4_reclass
411496631,PRESTO SERVICE,PRESTO SERVICE,"LA CREATION, L'ACHAT ET L'EXPLOITATION, DE TOUS FONDS DE COMMER CE DE TEINTURERIE, PRESSING AUTOMATIQUE OU NON",96.01B,Blanchisserie-teinturerie de détail,"SARL, société à responsabilité limitée",1997-03-24,False,,12 RUE DE L'ARCADE,,75008,PARIS,48.871493999801835,2.3236380000028007,PRESTO SERVICE,PRESTO SERVICE,41149663100044,1,4,False,,PRESSING,A4_reclass
901718148,LAVOMATTIC,LAVOMATTIC,laverie automatique,96.01B,Blanchisserie-teinturerie de détail,"SASU, société par actions simplifiée unipersonnelle",2021-06-11,False,,12 RUE DE LA STATION,MEUDON LA FORET,92360,MEUDON,48.78654399980186,2.227082000003197,,,90171814800017,1,1,False,,LS_PURE_NEW,A4_reclass
803129246,SILVA,SILVA,Pressing nettoyage a sec de vetements ou par machine a laver depot de linge repassage,96.01B,Blanchisserie-teinturerie de détail,"SARL, société à responsabilité limitée",2014-06-26,False,,54 RUE D'EREVAN,CENTRE COMMERCIAL LES EPINETTES,92130,ISSY-LES-MOULINEAUX,48.817529999801835,2.2606350000030595,PRESSING PLUS,,80312924600010,2,2,False,,PRESSING,A4_reclass
753854249,VOTRE VOISIN,VOTRE VOISIN,"Pressing, teinturerie.",96.01B,Blanchisserie-teinturerie de détail,"SARL, société à responsabilité limitée",2012-09-13,False,,21 RUE MARX DORMOY,,75018,PARIS,48.88596299980184,2.3592700000026543,,,75385424900012,0,1,False,,PRESSING,A4_reclass
504807124,HAS,HAS,"Teinturerie, nettoyage, pressing, stopage, remaillage, location de matériel, nettoyage.",96.01B,Blanchisserie-teinturerie de détail,"SARL, société à responsabilité limitée",2008-06-01,False,,55 RUE DE BEZONS,,92400,COURBEVOIE,48.89639299980186,2.248501000003115,MILO PRESSING,,50480712400012,1,1,False,,PRESSING,A4_reclass
881351779,AC AQUA CLEAN,AC AQUA CLEAN,"Teinturerie, pressing, blanchisserie, laverie, retouche, ventes savons écologiques et matériels de pressing, reprographie.",96.01B,Blanchisserie-teinturerie de détail,"EURL, entreprise unipersonnelle à responsabilité limitée",2020-02-01,False,,72 RUE CLAUDE BERNARD,,75005,PARIS,48.84046599980184,2.3458670000027086,WET CLEAN,EURL AQUA CLEAN,88135177900015,0,3,False,,MIXTE,A4_reclass
801528225,QUATORZE40,QUATORZE40,Blanchisserie-teinturerie de détail,96.01B,Blanchisserie-teinturerie de détail,"SAS, société par actions simplifiée",2014-04-07,False,,142 AVENUE DE VERSAILLES,,75016,PARIS,48.841685999801854,2.266528000003037,LEALY PRESSING,,80152822500056,4,5,False,,PRESSING,A4_reclass
830390019,ENSEL,ENSEL,"Exploitation de toutes activités de tous commerces de pressing, teinturerie, retoucherie, cordonnerie et ventes de petits textiles divers",96.01B,Blanchisserie-teinturerie de détail,"SARL, société à responsabilité limitée",2017-06-20,False,,16 RUE GAMBETTA,,92600,ASNIERES-SUR-SEINE,48.91010699980182,2.292514000002933,PRESSING GAMBETTA,,83039001900016,1,1,False,,PRESSING,A4_reclass
533164844,N & A,N & A,"Pressing, teinturerie, nettoyage à sec, rapassage, retouches.",96.01B,Blanchisserie-teinturerie de détail,"SARL, société à responsabilité limitée",2011-06-22,False,,152 RUE DE LA CONVENTION,,75015,PARIS,48.83911799980185,2.2920040000029305,,,53316484400011,1,1,False,,PRESSING,A4_reclass
538678871,SARL NATHAN,SARL NATHAN,"Pressing, blanchisserie, repassage.",96.01B,Blanchisserie-teinturerie de détail,"SARL, société à responsabilité limitée",2011-12-13,False,,40 RUE PERGOLESE,,75016,PARIS,48.87431799980183,2.2826030000029722,,,53867887100012,1,1,False,,PRESSING,A4_reclass
809129620,W&P,W&P,Teinturerie nettoyage et apprêts de tous vêtements stoppage remaillage repassage pressing et faux-cols laverie (y compris Lavomatique en libre service) retouche,96.01B,Blanchisserie-teinturerie de détail,"SARL, société à responsabilité limitée",2015-01-07,False,,8 RUE MAUBLANC,,75015,PARIS,48.840030999801854,2.2997230000028996,LA TEINTURERIE MAUBLANC,LA TEINTURERIE MAUBLANC,80912962000013,1,1,False,,MIXTE,A4_reclass
834043069,SPONTINI SERVICES,SPONTINI SERVICES,"Pressing, prestation de services aux entreprises et aux particuliers et sous-traitance en tous genres liés à la retoucherie et aux pressings. Négoce de Prêt-à-porter et de produits en tous genres non réglementés. Vente à emporter d'alcool.",96.01B,Blanchisserie-teinturerie de détail,"SASU, société par actions simplifiée unipersonnelle",2017-11-14,False,,98 BOULEVARD DU MONTPARNASSE,,75014,PARIS,48.84243999980186,2.327646000002784,,,83404306900022,2,3,False,Liquidation judiciaire,PRESSING,A4_reclass
532222262,DDH,DDH,"Pressing, laverie, import-export de tous produits non règlementés, vente à distance tous produits non règlementés par internet.",96.01B,Blanchisserie-teinturerie de détail,"SARL, société à responsabilité limitée",2011-05-10,False,,31 RUE GUERSANT,,75017,PARIS,48.881571999801835,2.289034000002946,TIP PRESSING,DDH,53222226200026,1,2,False,,MIXTE,A4_reclass
572203628,SAPAM APPLICATION PROCEDE AUTOMATIQ,SAPAM APPLICATION PROCEDE AUTOMATIQ,BLANCHISSERIE NETTOYAGE REPASSAGE,96.01B,Blanchisserie-teinturerie de détail,"SARL, société à responsabilité limitée",1957-01-01,False,,39 BOULEVARD HENRI IV,,75004,PARIS,48.852516999801864,2.366474000002623,PRESSING HENRI VI,PRESSING HENI IV,57220362800027,1,1,False,,PRESSING,A4_reclass
479203820,SOCIETE ANNA,SOCIETE ANNA,PRESSING BLANCHISSERIE TEINTURERIE RETOUCHES,96.01B,Blanchisserie-teinturerie de détail,"SARL, société à responsabilité limitée",2004-10-01,False,,216 RUE DU CHATEAU DES RENTIERS,,75013,PARIS,48.83173499980182,2.3604700000026466,,,47920382000010,3,3,False,,PRESSING,A4_reclass
824268841,THOLEA,THOLEA,"Laverie, dépôt de blanchisserie et de pressing.",96.01B,Blanchisserie-teinturerie de détail,"SAS, société par actions simplifiée",2016-12-12,False,,36 RUE ERNEST RENAN,,92130,ISSY-LES-MOULINEAUX,48.82811399980186,2.281078000002976,ISSY PRESSING,ISYY PRESSING,82426884100015,1,1,False,,MIXTE,A4_reclass
404167439,MONISOK,MONISOK,"LAVERIE AUTOMATIQUE, LIBRE SERVICE",96.01B,Blanchisserie-teinturerie de détail,"SASU, société par actions simplifiée unipersonnelle",1996-01-02,False,,2 RUE DU SOLEIL,,75020,PARIS,48.875139999801824,2.39401000000251,,,40416743900029,1,2,False,,LS_PURE_NEW,A4_reclass
424005866,MAKHA,MAKHA,"Pressing, Retoucherie",96.01B,Blanchisserie-teinturerie de détail,"SARL, société à responsabilité limitée",1999-08-01,False,,CENTRE COMMERCIAL CHARRAS,CHARRAS,92400,COURBEVOIE,0,0,,,42400586600019,1,1,False,,PRESSING,A4_reclass
572031417,DETACHENET,DETACHENET,Teinturerie dégraissage avec spécialité de nettoyage des tissus d'ameublement a domicile et a l'atelier,96.01B,Blanchisserie-teinturerie de détail,"SARL, société à responsabilité limitée",1957-01-01,False,,26 RUE FREYCINET,,75016,PARIS,48.86697399980185,2.2959510000029155,,,57203141700023,1,1,False,,PRESSING,A4_reclass
533524641,LE MIMOSA,LE MIMOSA,"Pressing, teinturerie, nettoyage à sec.",96.01B,Blanchisserie-teinturerie de détail,"SARL, société à responsabilité limitée",2011-07-12,False,,206 RUE ADOLPHE PAJEAUD,,92160,ANTONY,48.74075899980186,2.2815720000029684,PRESSING DE LA BIEVRE,,53352464100016,1,1,False,,PRESSING,A4_reclass
539575258,BLANCHINET,BLANCHINET,Laverie automatique repassage et dépot de teinturerie.,96.01B,Blanchisserie-teinturerie de détail,"SARL, société à responsabilité limitée",2012-01-01,False,,16 RUE JEAN NICOT,,93500,PANTIN,48.891465999801845,2.416151000002419,,,53957525800014,1,2,False,,LS_PURE_NEW,A4_reclass
498053560,KEN,KEN,"Pressing, blanchisserie, retouche, nettoyage de tous textiles et sous toutes ses formes.",96.01B,Blanchisserie-teinturerie de détail,"SARL, société à responsabilité limitée",2007-05-03,False,,1 PLACE DE BRUHL,,92330,SCEAUX,48.77851399980184,2.2933630000029215,,,49805356000021,1,2,False,,PRESSING,A4_reclass
751154196,N.V.P,N.V.P,"Pressing, nettoyage de vêtements, laverie, retoucherie.",96.01B,Blanchisserie-teinturerie de détail,"SARL, société à responsabilité limitée",2012-04-03,False,,13 RUE DE PICPUS,,75012,PARIS,48.846854999801835,2.394055000002508,,,75115419600016,1,1,False,,MIXTE,A4_reclass
798937512,L'O CLAIRE,L'O CLAIRE,Pressing,96.01B,Blanchisserie-teinturerie de détail,"SARL, société à responsabilité limitée",2013-12-04,False,,664 AVENUE ROGER SALENGRO,,92370,CHAVILLE,48.81528499980184,2.1933750000033383,,PRESSING L'O CLAIRE,79893751200027,1,2,False,Liquidation judiciaire,PRESSING,A4_reclass
352256374,CTI FLASH LIGHT,CTI FLASH LIGHT,"Blanchisserie, teinturerie, pressing",96.01B,Blanchisserie-teinturerie de détail,"SARL, société à responsabilité limitée",1989-11-01,False,,17 RUE GEORGES BIZET,,75016,PARIS,48.86728696716438,2.2977330028869702,,TEINTURERIE DU MAINE,35225637400088,1,7,False,,PRESSING,A4_reclass
450222450,AJBM ALAZARD,AJBM ALAZARD,"Laverie, pressing automatique",96.01B,Blanchisserie-teinturerie de détail,"SAS, société par actions simplifiée",2003-09-01,False,,40 RUE NOTRE-DAME DE LORETTE,,75009,PARIS,48.87922999980184,2.3366830000027474,PRESSING NETOMATIQUE,,45022245000048,1,4,False,,MIXTE,A4_reclass
403674666,K 2 M,K 2 M,LAVERIE,96.01B,Blanchisserie-teinturerie de détail,"SARL, société à responsabilité limitée",1996-02-01,False,,116 RUE ORFILA,,75020,PARIS,48.86814499980182,2.4007210000024832,,,40367466600017,1,1,False,,LS_PURE_NEW,A4_reclass
793855388,BLACK WHITE,BLACK WHITE,"Teinturerie, pressing, laverie.",96.01B,Blanchisserie-teinturerie de détail,"SARL, société à responsabilité limitée",2013-06-17,False,,72 RUE DE DUNKERQUE,,75009,PARIS,48.88227199980183,2.346088000002709,BLACK WHITE,BLACK WHITE,79385538800013,1,1,False,,MIXTE,A4_reclass
481069672,AYER,AYER,"PRESSING, BLANCHISSERIE, TEINTURERIE, RETOUCHERIE",96.01B,Blanchisserie-teinturerie de détail,"SARL, société à responsabilité limitée",2005-03-01,False,,54 AVENUE DU DOCTEUR ARNOLD NETTER,,75012,PARIS,48.84499799980185,2.40595500000246,,,48106967200014,1,1,False,,PRESSING,A4_reclass
384683256,SARL BICHAT,SARL BICHAT,TEINTURERIE BLANCHISSERIE PRESSING ET NEGOCE DE LA LINGERIE,96.01B,Blanchisserie-teinturerie de détail,"SARL, société à responsabilité limitée",1992-03-20,False,,41 RUE BICHAT,,75010,PARIS,48.87219099980184,2.3670360000026234,,BLANCHISSERIE BICHAT,38468325600026,1,2,False,,PRESSING,A4_reclass
497727255,LYSMUS,LYSMUS,"Teinturerie, blanchisserie, pressing",96.01B,Blanchisserie-teinturerie de détail,"SARL, société à responsabilité limitée",2007-04-16,False,,68 BOULEVARD ORNANO,,75018,PARIS,48.89636599980183,2.3459400000027113,,,49772725500018,1,1,False,,PRESSING,A4_reclass
523608271,SARL NATALIA,SARL NATALIA,"Pressing, blanchisserie, retouches, vêtements, dépôt relais colis.",96.01B,Blanchisserie-teinturerie de détail,"SARL, société à responsabilité limitée",2010-07-02,False,,24 AVENUE MATHURIN MOREAU,,75019,PARIS,48.87823299980184,2.373552000002595,,,52360827100012,1,1,False,,PRESSING,A4_reclass
417896404,PB INVEST,PB INVEST,Pressing blanchisserie,96.01B,Blanchisserie-teinturerie de détail,"SARL, société à responsabilité limitée",1998-03-01,False,,96 RUE SAINT-CHARLES,,75015,PARIS,48.845822999801854,2.284660000002962,,,41789640400171,8,17,True,Redressement judiciaire,PRESSING,A4_reclass
329416234,MULTISER LAFENESTRE,MULTISER LAFENESTRE,"LAVERIE, LIBRE SERVICE, PRESSING",96.01B,Blanchisserie-teinturerie de détail,"SAS, société par actions simplifiée",1984-03-19,False,,3 RUE DU DOCTEUR GOUJON,,75012,PARIS,48.83989199980183,2.397709000002494,LAV' CLUB,,32941623400022,1,2,False,,MIXTE,A4_reclass
815347307,GW2,GW2,Pressing et conciergerie.,96.01B,Blanchisserie-teinturerie de détail,"SASU, société par actions simplifiée unipersonnelle",2016-01-01,False,,137 RUE HOUDAN,,92330,SCEAUX,48.77893999980184,2.2827930000029664,AQUALOGIA,,81534730700028,1,2,True,Redressement judiciaire,PRESSING,A4_reclass
404860900,S M N,S M N,"PRESSING TEINTURERIE CONCERNANT TOUS VETEMENTS TAPIS, TOUTES PRESTATIONS DE SERVICES LIEES A CETTE ACTIVITE",96.01B,Blanchisserie-teinturerie de détail,"SARL, société à responsabilité limitée",1996-03-06,False,,30 RUE GREUZE,,75016,PARIS,48.86439399980182,2.2826430000029716,PRESSING DES SABLONS,PRESSING DES SABLONS,40486090000012,1,1,True,Liquidation judiciaire,PRESSING,A4_reclass
534290952,SALIBA,SALIBA,"Pressing, blanchisserie",96.01B,Blanchisserie-teinturerie de détail,"SARL, société à responsabilité limitée",2011-08-23,False,,108 AVENUE LEDRU-ROLLIN,,75011,PARIS,48.85255599980184,2.377043000002579,HARMONY,,53429095200017,1,1,False,,PRESSING,A4_reclass
819289539,AC CLEAN,AC CLEAN,"Pressing, nettoyage de tous textiles et sous toutes ses formes, laverie rapide, repassage, retouches des vêtements.",96.01B,Blanchisserie-teinturerie de détail,"SAS, société par actions simplifiée",2016-03-15,False,,90 B RUE DE MONTREUIL,,75011,PARIS,48.85066399980184,2.394978000002506,O'PRESSING,,81928953900010,1,1,False,,MIXTE,A4_reclass
532491602,OZVERI,OZVERI,"Pressing, retouche et accessoires s'y rapportant",96.01B,Blanchisserie-teinturerie de détail,"SARL, société à responsabilité limitée",2011-05-16,False,,12 B RUE DE L'ETOILE,,75017,PARIS,48.87717999980184,2.295707000002918,,,53249160200027,1,2,False,,PRESSING,A4_reclass
503246738,SUPERCLEAN,SUPERCLEAN,Blanchisserie-teinturerie de détail,96.01B,Blanchisserie-teinturerie de détail,"SARL, société à responsabilité limitée",2008-02-28,False,,204 RUE DE BELLEVILLE,N°204 AU 206,75020,PARIS,48.875155999801834,2.3949190000025062,CLEAN DISCOUNT PRESSING,CLEAN DISCOUNT PRESSING,50324673800028,1,2,False,,PRESSING,A4_reclass
572150159,SOCIETE AMSEC,SOCIETE AMSEC,Exploitation de toutes entreprises de blanchisseries Teinturerienettoyage et pressing ainsi que toutes opérations s'y rattachant,96.01B,Blanchisserie-teinturerie de détail,"SARL, société à responsabilité limitée",1957-01-01,False,,36 RUE DE RIVOLI,,75004,PARIS,48.85634199980184,2.3568450000026635,,,57215015900018,1,1,False,,PRESSING,A4_reclass
439946039,SARL AVYAS,SARL AVYAS,"Dépôt de laverie, teinturerie, achat-vente de lingerie drap rideau chaussures et bazar en ambulant",96.01B,Blanchisserie-teinturerie de détail,"SARL, société à responsabilité limitée",2001-11-15,False,,69 RUE JEAN LONGUET,,92290,CHATENAY-MALABRY,48.76712999980186,2.280168000002976,LAV'PRESS,LAV'PRESS,43994603900013,2,2,False,,LS_PURE_NEW,A4_reclass
520691825,PERSHING SERVICES,PERSHING SERVICES,Teinturerie blanchisserie pressing nettoyage à sec,96.01B,Blanchisserie-teinturerie de détail,"SARL, société à responsabilité limitée",2010-03-02,False,,1 BOULEVARD PERSHING,,75017,PARIS,48.88153999980184,2.285362000002962,,,52069182500027,1,2,False,,PRESSING,A4_reclass
830797189,CLEAN CORNER,CLEAN CORNER,"Teinturerie, blanchisserie, laverie, retoucherie, vente.",96.01B,Blanchisserie-teinturerie de détail,"SAS, société par actions simplifiée",2017-07-05,False,,16 RUE MANDAR,,75002,PARIS,48.86580499980185,2.3450580000027124,,,83079718900016,1,1,False,,MIXTE,A4_reclass
